<?xml version="1.0" encoding="UTF-8"?>
<!DOCTYPE mapping PUBLIC '-//tastefuljava.org//Jedo Mapping File 1.0//EN' 'jedo.dtd'>
<mapping package="org.tastefuljava.jedo.testdb">
    <class name="Folder">
        <id>
            <property name="id" column="ID"/>
        </id>
        <reference name="parent" column="PARENT_ID" fetch-mode="lazy"/>
        <property name="name" column="NAME"/>
        <collection name="subfolders" fetch-mode="lazy">
            <fetch>
                SELECT * FROM folders
                WHERE PARENT_ID=${parent.id}
            </fetch>
        </collection>
        <collection name="pictures" fetch-mode="eager">
            <fetch parent="folder">
                SELECT * FROM pictures
                WHERE FOLDER_ID=${folder.id}
            </fetch>
            <add parent="folder" element="picture">
                UPDATE pictures
                SET FOLDER_ID=${folder.id}
                WHERE ID=${picture.id}
            </add>
            <remove parent="folder" element="picture">
                DELETE FROM pictures
                WHERE FOLDER_ID=${folder.id} AND ID=${picture.id}
            </remove>
            <clear parent="folder">
                DELETE FROM pictures
                WHERE FOLDER_ID=${folder.id}
            </clear>
        </collection>

        <load>
            SELECT * FROM folders
            WHERE ID=${id}
        </load>
        <query name="rootFolder" parameters="name">
            SELECT * FROM folders
            WHERE PARENT_ID IS NULL
                AND NAME=${name}
        </query>
        <query name="subfolder" parameters="parent,name">
            SELECT * FROM folders
            WHERE PARENT_ID=${parent.id}
                AND NAME=${name}
        </query>
    </class>

    <class name="Picture">
        <id>
            <property name="id" column="ID"/>
        </id>
        <reference name="folder" column="FOLDER_ID"/>
        <property name="name" column="NAME"/>
        <property name="timestamp" column="TIMESTAMP"/>
        <property name="width" column="WIDTH"/>
        <property name="height" column="HEIGHT"/>
        <component name="gpsData">
            <property name="latitude" column="LATITUDE"/>
            <property name="longitude" column="LONGITUDE"/>
            <property name="altitude" column="ALTITUDE"/>
        </component>

        <load>
            SELECT * FROM pictures
            WHERE ID=${id}
        </load>
        <query name="byName" parameters="folder,name">
            SELECT * FROM pictures
            WHERE FOLDER_ID=${folder.id}
                AND NAME=${name}
        </query>
        <insert get-generated-keys="true">
            INSERT INTO pictures(FOLDER_ID,NAME,TIMESTAMP,WIDTH,HEIGHT,LATITUDE,
                LONGITUDE,ALTITUDE)
            VALUES(${folder.id},${name},${timestamp:TIMESTAMP},${width},
                ${height},${gpsData.latitude},${gpsData.longitude},
                ${gpsData.altitude})
        </insert>
        <update>
            UPDATE pictures SET FOLDER_ID=${folder.id},NAME=${name},
                TIMESTAMP=${timestamp:TIMESTAMP},WIDTH=${width},
                HEIGHT=${height},LATITUDE=${gpsData.latitude},
                LONGITUDE=${gpsData.longitude},
                ALTITUDE=${gpsData.altitude}
            WHERE ID=${id}
        </update>
        <delete>
            DELETE FROM pictures WHERE ID=${id}
        </delete>
    </class>
</mapping>
